Top_pages,Impressions,Position,Suggested_Title,Suggested_Meta_Description
https://www.hoosiercladding.com/home-siding-blog/install-a-metal-roof-ridge-cap,660,40.08,"When Do You Need to Replace Your Roof Ridge Cap?","Licensed contractors explain roof ridge cap replacement signs, installation requirements, and when professional help is needed for Indiana homes."
https://www.hoosiercladding.com/,518,29.93,"Siding Contractors in South Bend, IN | Licensed & Insured","Licensed siding contractors serving South Bend, Mishawaka, and Northern Indiana. Expert installation, repair, and replacement. Free estimates. Call (574) 931-2119 today."
https://www.hoosiercladding.com/home-siding-blog/siding-replacement-costs-indiana-2025,418,29.24,"How Much Does Siding Replacement Cost in Indiana Homes?","Licensed South Bend siding contractors break down siding replacement costs by material, home size, and factors affecting pricing in Northern Indiana."
https://www.hoosiercladding.com/home-siding-blog/does-home-insurance-cover-broken-windows-what-indiana-homeowners-need-to-know,345,73.86,"Does Home Insurance Cover Broken Windows in Indiana?","Licensed contractors explain home insurance coverage for broken windows, common claim scenarios, and when replacement qualifies for coverage in Indiana."
https://www.hoosiercladding.com/vinyl-siding-michiana-south-bend,31,27.9,"Vinyl Siding Installers in South Bend, IN | Free Quote","Professional vinyl siding installation in South Bend, IN. Licensed installers with 15+ years experience. Same-day quotes. Call (574) 931-2119 for free estimate."
https://www.hoosiercladding.com/home-siding-blog/does-home-insurance-cover-broken-windows-what-indiana-homeowners-need-to-know-1,95,58.54,Does Home Insurance Cover Broken Windows What Indiana Homeowners Need To Know 1 | Hoosier Cladding,"Expert siding services across Northern Indiana. Repairs, full replacements, and insulation upgrades done right. Get a same‑week estimate from Hoosier Cladding."
https://www.hoosiercladding.com/door-replacement-south-bend,12,44.25,"Door Replacement Contractors South Bend, IN","Licensed door replacement contractors in South Bend, IN. Entry doors, storm doors, energy-efficient options. Free estimates. Call (574) 931-2119."
https://www.hoosiercladding.com/trimwork-south-bend,1,5,"Trimwork Contractors South Bend, IN | Licensed","Professional trimwork contractors in South Bend, IN. Fascia, soffits, corner boards, window trim. Licensed & insured. Free estimates. (574) 931-2119."
https://www.hoosiercladding.com/window-replacement-south-bend,0,63.73,"Window Replacement Contractors South Bend, IN","Licensed window replacement contractors in South Bend, IN. Energy-efficient windows, expert installation, lifetime warranties. Free estimates. (574) 931-2119."
https://www.hoosiercladding.com/home-siding-blog,24,50.42,"Home Siding Blog | South Bend Siding Contractors & Installers","Expert siding insights from licensed South Bend siding contractors covering vinyl siding, fiber cement, repairs, and replacement for Indiana homeowners."
https://www.hoosiercladding.com/residential-siding-contractor,2,55,"Residential Siding Contractor South Bend, IN","Licensed residential siding contractor in South Bend, IN. Expert installation, repair, replacement. 15+ years experience. Free estimates. (574) 931-2119."
https://www.hoosiercladding.com/house-siding-replacement,2,8,"House Siding Replacement Contractors South Bend","House siding replacement contractors in South Bend, IN. Complete installation, quality materials, licensed & insured. Free estimates. Call (574) 931-2119."
https://www.hoosiercladding.com/vinyl-siding-installers,4,16,"Vinyl Siding Installers Near Me | South Bend, IN","Licensed vinyl siding installers serving South Bend, IN and Northern Indiana. Expert installation, same-day quotes. Free estimates. Call (574) 931-2119."

